{
  "schema": "dot-photo/style/1",
  "name": "neutral",
  "description": "No change. Baseline for landscape/portrait actions when no style is given.",
  "tone": {"exposure": 0, "contrast": 0, "highlights": 0, "shadows": 0, "whites": 0, "blacks": 0},
  "color": {"temperature": 0, "tint": 0, "vibrance": 0, "saturation": 0},
  "curve": {"rgb": null, "r": null, "g": null, "b": null},
  "hsl": {},
  "grade": {},
  "effects": {"clarity": 0, "texture": 0, "dehaze": 0, "vignette": 0, "grain": 0},
  "stats": null,
  "notes": []
}
